{
  "$schema": "../../../schemas/stable/mxc-config.schema.1.0.0.json",
  "version": "1.0.0",
  "containerId": "UI-Test-07",
  "containment": "processcontainer",
  "process": {
    "commandLine": "cmd.exe /c \"tasklist /FI \"IMAGENAME eq explorer.exe\" | findstr explorer.exe && echo FAIL: can see explorer || echo PASS: handles isolated\"",
    "timeout": 15000
  },
  "processContainer": { "capabilities": [], "ui": { "isolation": "container", "desktopSystemControl": false, "systemSettings": "none", "ime": false } },
  "ui": { "disable": false, "clipboard": "none", "injection": false }
}
