{
  "$schema": "../../../schemas/stable/mxc-config.schema.1.0.0.json",
  "version": "1.0.0",
  "containerId": "UI-Test-11",
  "containment": "processcontainer",
  "process": {
    "commandLine": "cmd.exe /c \"mode con cols=40 2>nul && echo FAIL: display settings changed || echo PASS: display settings blocked\"",
    "timeout": 15000
  },
  "processContainer": { "capabilities": [], "ui": { "isolation": "desktop", "desktopSystemControl": false, "systemSettings": "none", "ime": false } },
  "ui": { "disable": false, "clipboard": "none", "injection": false }
}
