{
  "version": "0.5.0-alpha",
  "containerId": "PLM-DisplaySettings-Basic",
  "containment": "processcontainer",
  "process": {
    "commandLine": "c:\\users\\adminuser\\desktop\\lily\\plmtester.exe display-settings",
    "timeout": 30000
  },
  "ui": {
    "disable": false,
    "systemSettings": "none"
  }
}
