{
    "$schema": "../../schemas/stable/mxc-config.schema.1.0.0.json",
    "version": "1.0.0",
    "containment": "seatbelt",
    "process": {
        "commandLine": "pbpaste > /dev/null 2>&1 && echo CLIPBOARD_OK || echo CLIPBOARD_BLOCKED",
        "timeout": 20000
    },
    "ui": {
        "disable": false,
        "clipboard": "all"
    }
}
