{
  "$schema": "../../../../schemas/dev/mxc-config.schema.0.8.0-dev.json",
  "version": "0.8.0-dev",
  "containerId": "CLI-BaseContainer-v08-Port-Range",
  "containment": "processcontainer",
  "process": {
    "commandLine": "powershell.exe -NoProfile -NonInteractive -Command \"$client = [Net.Sockets.TcpClient]::new(); try { $connected = $client.ConnectAsync('1.1.1.1', 443).Wait(5000) } catch { $connected = $false } finally { $client.Dispose() }; if ($connected) { Write-Output 'OK:allow_port_range_tcp443'; exit 0 }; Write-Output 'FAIL:allow_port_range_tcp443_blocked'; exit 1\"",
    "timeout": 15000
  },
  "filesystem": {
    "readonlyPaths": ["C:\\Windows"]
  },
  "ui": {
    "disable": false
  },
  "network": {
    "egress": {
      "default": "deny",
      "allow": [
        {
          "to": [{"cidr": "1.1.1.1/32"}],
          "ports": [{"protocol": "tcp", "port": 440, "endPort": 450}]
        }
      ]
    }
  }
}
