{
    "$schema": "../../schemas/stable/mxc-config.schema.0.8.0-alpha.json",
    "version": "0.8.0-alpha",
    "containment": "seatbelt",
    "process": {
        "commandLine": "echo 'Testing network restrictions...'; echo ''; echo 'macOS Seatbelt has no per-host filtering primitive, so this policy is a'; echo 'blanket outbound deny -- allowedHosts is rejected under defaultPolicy=block.'; echo 'For proxy-scoped egress see 31_mac_network_0_8.json.'; echo ''; rc=0; echo 'Test 1: Connecting to api.github.com...'; if curl -s --max-time 5 https://api.github.com/zen > /dev/null 2>&1; then echo '  ERROR: Should not have connected!'; rc=1; else echo '  SUCCESS: Connection blocked as expected'; fi; echo ''; echo 'Test 2: Connecting to example.com...'; if curl -s --max-time 5 https://example.com > /dev/null 2>&1; then echo '  ERROR: Should not have connected!'; rc=1; else echo '  SUCCESS: Connection blocked as expected'; fi; echo ''; if [ $rc -eq 0 ]; then echo 'Network restriction test complete!'; else echo 'Network restriction test FAILED'; fi; exit $rc",
        "timeout": 30000
    },
    "filesystem": {
        "readwritePaths": [
            "/tmp"
        ]
    },
    "network": {
        "defaultPolicy": "block"
    }
}
